{
  "$schema": "../../schemas/questions/sprach-a-lyzer_question-rendering-catalogue_v0.1.json",
  "catalogue_version": "0.1",
  "status": "APPROVED",
  "locale": "de-DE",
  "canonical_question_contract": "0.1",
  "rendering_contract": "0.2",
  "canonical_intents": {
    "CQ007": "LOCUS_OF_CONTROL", "CQ008": "RESOURCES", "CQ009": "VALUES", "CQ013": "BELIEFS",
    "CQ021": "CLARITY", "CQ023": "ASSUMPTIONS", "CQ024": "PERSPECTIVE_TAKING", "CQ034": "OPTIONS"
  },
  "quality_limits": {"leadingness_delta": 0.2, "intimacy_delta": 0.45, "spiritual_explicitness_delta": 0.5},
  "renderings": [
    {"contract_version":"0.2","rendering_id":"CQ007:PRIVATE:STANDARD:CANONICAL:v1","question_id":"CQ007","construct_intent":"LOCUS_OF_CONTROL","profile":"PRIVATE","presentation_mode":"STANDARD","variant":"CANONICAL","language_level":"STANDARD","locale":"de-DE","text":"Was davon liegt heute tatsächlich in deinem Einflussbereich?","leadingness":0.2,"specificity":0.75,"intimacy_level":0.2,"spiritual_explicitness":0,"relational_warmth":0.5,"requires_opt_in":false,"semantic_equivalence":true,"scoring":false,"status":"APPROVED","version":1},
    {"contract_version":"0.2","rendering_id":"CQ007:PRIVATE:EASY:SIMPLIFY:v1","question_id":"CQ007","construct_intent":"LOCUS_OF_CONTROL","profile":"PRIVATE","presentation_mode":"EASY","variant":"SIMPLIFY","language_level":"EASY","locale":"de-DE","text":"Was kannst du heute selbst beeinflussen?","leadingness":0.2,"specificity":0.8,"intimacy_level":0.2,"spiritual_explicitness":0,"relational_warmth":0.5,"requires_opt_in":false,"semantic_equivalence":true,"scoring":false,"status":"APPROVED","version":1},
    {"contract_version":"0.2","rendering_id":"CQ007:CORPORATE:STANDARD:CANONICAL:v1","question_id":"CQ007","construct_intent":"LOCUS_OF_CONTROL","profile":"CORPORATE","presentation_mode":"STANDARD","variant":"CANONICAL","language_level":"STANDARD","locale":"de-DE","text":"Was davon liegt heute tatsächlich in Ihrem Einflussbereich?","leadingness":0.2,"specificity":0.75,"intimacy_level":0.1,"spiritual_explicitness":0,"relational_warmth":0.5,"requires_opt_in":false,"semantic_equivalence":true,"scoring":false,"status":"APPROVED","version":1},
    {"contract_version":"0.2","rendering_id":"CQ007:CORPORATE:EASY:SIMPLIFY:v1","question_id":"CQ007","construct_intent":"LOCUS_OF_CONTROL","profile":"CORPORATE","presentation_mode":"EASY","variant":"SIMPLIFY","language_level":"EASY","locale":"de-DE","text":"Was können Sie heute selbst beeinflussen?","leadingness":0.2,"specificity":0.8,"intimacy_level":0.1,"spiritual_explicitness":0,"relational_warmth":0.5,"requires_opt_in":false,"semantic_equivalence":true,"scoring":false,"status":"APPROVED","version":1},
    {"contract_version":"0.2","rendering_id":"CQ007:PRIVATE:DEEP_REFLECTIVE:ALTERNATIVE_PERSPECTIVE:v1","question_id":"CQ007","construct_intent":"LOCUS_OF_CONTROL","profile":"PRIVATE","presentation_mode":"DEEP_REFLECTIVE","variant":"ALTERNATIVE_PERSPECTIVE","language_level":"STANDARD","locale":"de-DE","text":"Wo spürst du in dieser Situation einen eigenen, frei wählbaren Handlungsschritt?","leadingness":0.35,"specificity":0.7,"intimacy_level":0.6,"spiritual_explicitness":0.25,"relational_warmth":0.7,"requires_opt_in":true,"semantic_equivalence":true,"scoring":false,"status":"APPROVED","version":1},

    {"contract_version":"0.2","rendering_id":"CQ008:PRIVATE:STANDARD:CANONICAL:v1","question_id":"CQ008","construct_intent":"RESOURCES","profile":"PRIVATE","presentation_mode":"STANDARD","variant":"CANONICAL","language_level":"STANDARD","locale":"de-DE","text":"Was funktioniert trotz der Herausforderung bereits ein wenig?","leadingness":0.25,"specificity":0.65,"intimacy_level":0.2,"spiritual_explicitness":0,"relational_warmth":0.5,"requires_opt_in":false,"semantic_equivalence":true,"scoring":false,"status":"APPROVED","version":1},
    {"contract_version":"0.2","rendering_id":"CQ008:PRIVATE:EASY:SIMPLIFY:v1","question_id":"CQ008","construct_intent":"RESOURCES","profile":"PRIVATE","presentation_mode":"EASY","variant":"SIMPLIFY","language_level":"EASY","locale":"de-DE","text":"Was hilft dir schon ein wenig?","leadingness":0.25,"specificity":0.7,"intimacy_level":0.25,"spiritual_explicitness":0,"relational_warmth":0.55,"requires_opt_in":false,"semantic_equivalence":true,"scoring":false,"status":"APPROVED","version":1},
    {"contract_version":"0.2","rendering_id":"CQ008:CORPORATE:STANDARD:CANONICAL:v1","question_id":"CQ008","construct_intent":"RESOURCES","profile":"CORPORATE","presentation_mode":"STANDARD","variant":"CANONICAL","language_level":"STANDARD","locale":"de-DE","text":"Was funktioniert trotz der Herausforderung bereits ein wenig?","leadingness":0.25,"specificity":0.65,"intimacy_level":0.1,"spiritual_explicitness":0,"relational_warmth":0.5,"requires_opt_in":false,"semantic_equivalence":true,"scoring":false,"status":"APPROVED","version":1},
    {"contract_version":"0.2","rendering_id":"CQ008:CORPORATE:EASY:SIMPLIFY:v1","question_id":"CQ008","construct_intent":"RESOURCES","profile":"CORPORATE","presentation_mode":"EASY","variant":"SIMPLIFY","language_level":"EASY","locale":"de-DE","text":"Was hilft bereits ein wenig?","leadingness":0.25,"specificity":0.7,"intimacy_level":0.1,"spiritual_explicitness":0,"relational_warmth":0.5,"requires_opt_in":false,"semantic_equivalence":true,"scoring":false,"status":"APPROVED","version":1},
    {"contract_version":"0.2","rendering_id":"CQ008:PRIVATE:DEEP_REFLECTIVE:ALTERNATIVE_PERSPECTIVE:v1","question_id":"CQ008","construct_intent":"RESOURCES","profile":"PRIVATE","presentation_mode":"DEEP_REFLECTIVE","variant":"ALTERNATIVE_PERSPECTIVE","language_level":"STANDARD","locale":"de-DE","text":"Welche innere oder äußere Kraft trägt dich in dieser Herausforderung bereits?","leadingness":0.4,"specificity":0.6,"intimacy_level":0.6,"spiritual_explicitness":0.3,"relational_warmth":0.75,"requires_opt_in":true,"semantic_equivalence":true,"scoring":false,"status":"APPROVED","version":1},

    {"contract_version":"0.2","rendering_id":"CQ009:PRIVATE:STANDARD:CANONICAL:v1","question_id":"CQ009","construct_intent":"VALUES","profile":"PRIVATE","presentation_mode":"STANDARD","variant":"CANONICAL","language_level":"STANDARD","locale":"de-DE","text":"Was ist dir an dieser Situation besonders wichtig?","leadingness":0.2,"specificity":0.7,"intimacy_level":0.25,"spiritual_explicitness":0,"relational_warmth":0.5,"requires_opt_in":false,"semantic_equivalence":true,"scoring":false,"status":"APPROVED","version":1},
    {"contract_version":"0.2","rendering_id":"CQ009:PRIVATE:EASY:SIMPLIFY:v1","question_id":"CQ009","construct_intent":"VALUES","profile":"PRIVATE","presentation_mode":"EASY","variant":"SIMPLIFY","language_level":"EASY","locale":"de-DE","text":"Was ist dir dabei wichtig?","leadingness":0.2,"specificity":0.65,"intimacy_level":0.25,"spiritual_explicitness":0,"relational_warmth":0.5,"requires_opt_in":false,"semantic_equivalence":true,"scoring":false,"status":"APPROVED","version":1},
    {"contract_version":"0.2","rendering_id":"CQ009:CORPORATE:STANDARD:CANONICAL:v1","question_id":"CQ009","construct_intent":"VALUES","profile":"CORPORATE","presentation_mode":"STANDARD","variant":"CANONICAL","language_level":"STANDARD","locale":"de-DE","text":"Was ist Ihnen an dieser Situation besonders wichtig?","leadingness":0.2,"specificity":0.7,"intimacy_level":0.1,"spiritual_explicitness":0,"relational_warmth":0.5,"requires_opt_in":false,"semantic_equivalence":true,"scoring":false,"status":"APPROVED","version":1},
    {"contract_version":"0.2","rendering_id":"CQ009:CORPORATE:EASY:SIMPLIFY:v1","question_id":"CQ009","construct_intent":"VALUES","profile":"CORPORATE","presentation_mode":"EASY","variant":"SIMPLIFY","language_level":"EASY","locale":"de-DE","text":"Was ist Ihnen dabei wichtig?","leadingness":0.2,"specificity":0.65,"intimacy_level":0.1,"spiritual_explicitness":0,"relational_warmth":0.5,"requires_opt_in":false,"semantic_equivalence":true,"scoring":false,"status":"APPROVED","version":1},
    {"contract_version":"0.2","rendering_id":"CQ009:PRIVATE:DEEP_REFLECTIVE:ALTERNATIVE_PERSPECTIVE:v1","question_id":"CQ009","construct_intent":"VALUES","profile":"PRIVATE","presentation_mode":"DEEP_REFLECTIVE","variant":"ALTERNATIVE_PERSPECTIVE","language_level":"STANDARD","locale":"de-DE","text":"Welcher Wert in dir möchte in dieser Situation gehört werden?","leadingness":0.35,"specificity":0.65,"intimacy_level":0.65,"spiritual_explicitness":0.35,"relational_warmth":0.75,"requires_opt_in":true,"semantic_equivalence":true,"scoring":false,"status":"APPROVED","version":1},

    {"contract_version":"0.2","rendering_id":"CQ013:PRIVATE:STANDARD:CANONICAL:v1","question_id":"CQ013","construct_intent":"BELIEFS","profile":"PRIVATE","presentation_mode":"STANDARD","variant":"CANONICAL","language_level":"STANDARD","locale":"de-DE","text":"Welchen Satz sagst du dir selbst am häufigsten über diese Situation?","leadingness":0.3,"specificity":0.8,"intimacy_level":0.35,"spiritual_explicitness":0,"relational_warmth":0.5,"requires_opt_in":false,"semantic_equivalence":true,"scoring":false,"status":"APPROVED","version":1},
    {"contract_version":"0.2","rendering_id":"CQ013:PRIVATE:EASY:SIMPLIFY:v1","question_id":"CQ013","construct_intent":"BELIEFS","profile":"PRIVATE","presentation_mode":"EASY","variant":"SIMPLIFY","language_level":"EASY","locale":"de-DE","text":"Was sagst du dir selbst dazu?","leadingness":0.25,"specificity":0.7,"intimacy_level":0.35,"spiritual_explicitness":0,"relational_warmth":0.5,"requires_opt_in":false,"semantic_equivalence":true,"scoring":false,"status":"APPROVED","version":1},